{
  "run_id": "20260225T235150Z_claude_fix-8-core-summary-jsons-for-sch_22d6bdc1",
  "timestamp_utc": "2026-02-25T23:51:50Z",
  "tool": "claude",
  "purpose": "Fix 8 core summary JSONs for schema conformance + Step 2 review memo",
  "prompt_sha256": "b4a105892c8073eb8124612a8371e6d1432305371005bfc3917382120da27615",
  "inputs_scanned": [
    "analysis/results/summary_env_definitive.json",
    "analysis/results/summary_nonparametric_inversion.json",
    "analysis/results/summary_env_confound_control.json",
    "analysis/results/summary_split_half_replication.json",
    "analysis/results/summary_propensity_matched_env.json",
    "analysis/results/summary_lcdm_null_inversion.json",
    "analysis/results/summary_kurtosis_disambiguation.json",
    "analysis/results/summary_probes_inversion_replication.json",
    "analysis/pipeline/test_env_scatter_definitive.py",
    "analysis/pipeline/test_nonparametric_inversion.py",
    "analysis/pipeline/test_env_confound_control.py",
    "analysis/pipeline/test_split_half_replication.py",
    "analysis/pipeline/test_propensity_matched_env.py",
    "analysis/pipeline/test_lcdm_null_inversion.py",
    "analysis/pipeline/test_kurtosis_disambiguation.py",
    "analysis/pipeline/test_probes_inversion_replication.py",
    "evidence_vault/reproducibility/alignment_inventory.csv"
  ],
  "outputs_changed": [
    "analysis/results/summary_env_definitive.json",
    "analysis/results/summary_nonparametric_inversion.json",
    "analysis/results/summary_env_confound_control.json",
    "analysis/results/summary_split_half_replication.json",
    "analysis/results/summary_propensity_matched_env.json",
    "analysis/results/summary_lcdm_null_inversion.json",
    "analysis/results/summary_kurtosis_disambiguation.json",
    "analysis/results/summary_probes_inversion_replication.json",
    "evidence_vault/reproducibility/alignment_inventory.csv",
    "evidence_vault/reproducibility/alignment_inventory_summary.md",
    "evidence_vault/reproducibility/claude_review_step2.md",
    "docs/SCHEMA.md",
    "tools/osf_packaging/log_run.py"
  ],
  "git_commit": "54281196f4eb2b2e0047b16b49536f51427efdc1",
  "todos_remaining": [],
  "notes": "Added description field to 7 core summaries. Renamed test to test_name in summary_lcdm_null_inversion.json. Re-ran inventory: State 1 count 16\u219232. Also fixed docs/SCHEMA.md workflow order and added --git-commit flag to log_run.py."
}
