{
  "run_id": "20260225T212102Z_claude_resolve-osf-metadata-todos-citat_b26e7ade",
  "timestamp_utc": "2026-02-25T21:21:02Z",
  "tool": "claude",
  "purpose": "Resolve OSF metadata TODOs: citations, source URLs, retrieval dates across DATASETS_INDEX, TERMS_OF_USE, CITATION files, ARTIFACTS_INDEX",
  "prompt_sha256": "7525f989400b4e23697aaa3740e891afb61680b3cc82b8d3ed79717eac1244c7",
  "inputs_scanned": [
    "DATASETS_INDEX.md",
    "ARTIFACTS_INDEX.md",
    "CITATION.cff",
    "raw_data/observational/*/TERMS_OF_USE.md",
    "raw_data/observational/*/CITATION.md",
    "raw_data/tng/*/TERMS_OF_USE.md",
    "raw_data/tng/*/CITATION.md"
  ],
  "outputs_changed": [
    "DATASETS_INDEX.md",
    "ARTIFACTS_INDEX.md",
    "CITATION.cff",
    "raw_data/observational/alfalfa/TERMS_OF_USE.md",
    "raw_data/observational/alfalfa/CITATION.md",
    "raw_data/observational/by_system/TERMS_OF_USE.md",
    "raw_data/observational/by_system/CITATION.md",
    "raw_data/observational/cf4/TERMS_OF_USE.md",
    "raw_data/observational/cf4/CITATION.md",
    "raw_data/observational/environment/TERMS_OF_USE.md",
    "raw_data/observational/environment/CITATION.md",
    "raw_data/observational/hi_surveys/TERMS_OF_USE.md",
    "raw_data/observational/hi_surveys/CITATION.md",
    "raw_data/observational/literature/TERMS_OF_USE.md",
    "raw_data/observational/literature/CITATION.md",
    "raw_data/observational/little_things/TERMS_OF_USE.md",
    "raw_data/observational/little_things/CITATION.md",
    "raw_data/observational/littlethings/TERMS_OF_USE.md",
    "raw_data/observational/littlethings/CITATION.md",
    "raw_data/observational/mhongoose/TERMS_OF_USE.md",
    "raw_data/observational/mhongoose/CITATION.md",
    "raw_data/observational/misc/TERMS_OF_USE.md",
    "raw_data/observational/misc/CITATION.md",
    "raw_data/observational/phangs/TERMS_OF_USE.md",
    "raw_data/observational/phangs/CITATION.md",
    "raw_data/observational/probes/TERMS_OF_USE.md",
    "raw_data/observational/probes/CITATION.md",
    "raw_data/observational/s4g/TERMS_OF_USE.md",
    "raw_data/observational/s4g/CITATION.md",
    "raw_data/observational/sofue/TERMS_OF_USE.md",
    "raw_data/observational/sofue/CITATION.md",
    "raw_data/observational/sparc/TERMS_OF_USE.md",
    "raw_data/observational/tempel/TERMS_OF_USE.md",
    "raw_data/observational/tempel/CITATION.md",
    "raw_data/observational/things/TERMS_OF_USE.md",
    "raw_data/observational/things/CITATION.md",
    "raw_data/observational/vizier_catalogs/TERMS_OF_USE.md",
    "raw_data/observational/vizier_catalogs/CITATION.md",
    "raw_data/observational/voids/TERMS_OF_USE.md",
    "raw_data/observational/voids/CITATION.md",
    "raw_data/observational/wallaby/TERMS_OF_USE.md",
    "raw_data/observational/wallaby/CITATION.md",
    "raw_data/observational/yang_catalogs/TERMS_OF_USE.md",
    "raw_data/observational/yang_catalogs/CITATION.md",
    "raw_data/observational/brouwer2021/TERMS_OF_USE.md",
    "raw_data/observational/cluster_rar/TERMS_OF_USE.md",
    "raw_data/observational/eagle_rar/TERMS_OF_USE.md",
    "raw_data/tng/TNG_RAR_3000x50_SOFT1p5_RUN201626_VERIFIED/TERMS_OF_USE.md",
    "raw_data/tng/TNG_RAR_48133x50_SOFT1p5_RUN20260223_061026_BIG_BASE/TERMS_OF_USE.md",
    "raw_data/tng/ingestion_staging/TERMS_OF_USE.md",
    "raw_data/tng/quarantine_contaminated/TERMS_OF_USE.md",
    "raw_data/tng/raw_archives/TERMS_OF_USE.md"
  ],
  "git_commit": "1992e64105eb196515d65c1d7f8854038c79faa8",
  "todos_remaining": [],
  "notes": "Retroactive log for commit 26d21e0. All citations verified via web search \u2014 no DOIs fabricated. MULTI_SOURCE tag used for aggregation folders. CITATION.cff OSF/GitHub URLs left as explicit TODOs (no project IDs available). ARTIFACTS_INDEX figure paths set to N/A (test scripts produce JSON only). Remaining TODOs: data_dictionary.md column descriptions, download_instructions.md source URLs, CITATION.cff project URLs.",
  "warnings": [
    "Run log created after commit rather than before \u2014 retroactive logging"
  ]
}
