{
  "run_id": "20260225T211119Z_codex_add-append-only-run-logging-sche_d185cb91",
  "timestamp_utc": "2026-02-25T21:11:19Z",
  "tool": "codex",
  "purpose": "Add append-only run logging + schemas",
  "prompt_sha256": "1398466b0b8d4b25b549146a1f162b779d3524c06827b82746e998657dafaca1",
  "inputs_scanned": [
    "repo root",
    "tools/osf_packaging/"
  ],
  "outputs_changed": [
    "AGENTS.md",
    "docs/SCHEMA.md",
    "docs/schemas/run_log_schema.json",
    "docs/schemas/summary_schema.json",
    "logs/runs/.gitkeep",
    "tools/osf_packaging/log_run.py",
    "tools/osf_packaging/commit_log.sh"
  ],
  "git_commit": "7eeee44d805e71ae3ae6e4de01e771484e7426e1",
  "todos_remaining": []
}
